{
  "type": "navigation.packet",
  "schemaVersion": 2,
  "serverTimeMs": 1790000000000,
  "ptsSeconds": 12.3,
  "tripTimestampMs": 1730000012300,
  "routeState": {
    "action": "TURN_RIGHT",
    "audio": "TURN RIGHT in 28 m.",
    "ui": "TURN_ARROW",
    "distanceMeters": 28,
    "offRoute": false,
    "etaSeconds": 27,
    "remainingDistanceMeters": 208,
    "requiredLane": null,
    "turnDirection": "right",
    "roadName": "Mock Street"
  },
  "packet": {
    "packetType": "SPATIAL_NAVIGATION_PACKET",
    "tripId": "demo_b1ff4656-0435391e",
    "routeId": "demo_b1ff4656-0435391e_mock",
    "generatedAtMs": 1730000012039,
    "source": {
      "provider": "mock",
      "routeApiVersion": "mock-v1"
    },
    "destination": {
      "label": "Piedmont Park",
      "placeId": "mock_2319954122",
      "coordinate": {
        "lat": 33.778319999999994,
        "lng": -84.39576
      }
    },
    "progress": {
      "currentLocation": {
        "lat": 33.7764204,
        "lng": -84.3961717
      },
      "heading": 7.4,
      "speedMps": 7.64,
      "routeIndex": 0,
      "distanceTraveledMeters": 92,
      "remainingDistanceMeters": 208,
      "etaSeconds": 27,
      "offRoute": false
    },
    "route": {
      "polyline": "oxcmEzsbbOsD[}De@mDi@",
      "steps": [
        {
          "stepId": "step_1",
          "instruction": "Continue on the current road",
          "maneuver": "straight",
          "distanceMeters": 120,
          "durationSeconds": 20,
          "roadName": "Mock Avenue"
        },
        {
          "stepId": "step_2",
          "instruction": "Turn right onto the next road",
          "maneuver": "right",
          "distanceMeters": 180,
          "durationSeconds": 30,
          "roadName": "Mock Street"
        },
        {
          "stepId": "step_3",
          "instruction": "Arrive at Piedmont Park",
          "maneuver": "arrive",
          "distanceMeters": 0,
          "durationSeconds": 0,
          "roadName": "Piedmont Park"
        }
      ],
      "totalDistanceMeters": 300,
      "totalDurationSeconds": 50
    },
    "activeManeuver": {
      "eventId": "step_2",
      "type": "TURN_RIGHT",
      "distanceMeters": 120,
      "roadName": "Mock Street",
      "instruction": "Turn right onto the next road"
    },
    "upcomingManeuvers": [
      {
        "eventId": "step_2",
        "type": "TURN_RIGHT",
        "distanceMeters": 120,
        "roadName": "Mock Street",
        "instruction": "Turn right onto the next road",
        "priority": 1
      },
      {
        "eventId": "step_3",
        "type": "ARRIVE",
        "distanceMeters": 300,
        "roadName": "Piedmont Park",
        "instruction": "Arrive at Piedmont Park",
        "priority": 2
      }
    ],
    "spatialInstructions": [
      {
        "id": "spatial_step_2",
        "type": "TURN_ARROW",
        "anchor": {
          "kind": "ROUTE_POINT",
          "routeDistanceMeters": 120
        },
        "content": "TURN RIGHT\n28 m",
        "priority": 1,
        "lifetimeMs": 4000
      }
    ],
    "audioInstructions": [
      {
        "id": "audio_step_2",
        "content": "TURN RIGHT in 28 m.",
        "priority": 1,
        "speakAtDistanceMeters": 120
      }
    ],
    "routeSemantics": {
      "roadName": "Mock Street",
      "highwayName": null,
      "turnDirection": "right"
    },
    "handoffHints": {
      "confidence": 0.95,
      "displayPriority": 1,
      "staleAfterMs": 5000
    }
  }
}
