{"type":"navigation.packet","schemaVersion":2,"serverTimeMs":1790000000000,"ptsSeconds":12.3,"tripTimestampMs":1730000012300,
 "routeState":{"action":"TURN_RIGHT","audio":"Turn right in 120 m.","ui":"TURN_ARROW","distanceMeters":120,"offRoute":false,"etaSeconds":95,"remainingDistanceMeters":840,"requiredLane":null,"turnDirection":"right","roadName":"North Ave"},
 "packet":{"packetType":"SPATIAL_NAVIGATION_PACKET","tripId":"gt-loop-01","routeId":"route_0","generatedAtMs":1730000012300,
  "source":{"provider":"mock"},
  "destination":{"label":"Georgia Tech Student Center","coordinate":{"lat":33.7743,"lng":-84.3983}},
  "progress":{"currentLocation":{"lat":33.7756,"lng":-84.3963},"heading":91.2,"speedMps":8.4,"routeIndex":3,"distanceTraveledMeters":410,"remainingDistanceMeters":840,"etaSeconds":95,"offRoute":false},
  "route":{"polyline":"_p~iF~ps|U_ulLnnqC","steps":[],"totalDistanceMeters":1250,"totalDurationSeconds":180},
  "activeManeuver":{"eventId":"evt_2","type":"TURN_RIGHT","distanceMeters":530,"roadName":"North Ave"},
  "upcomingManeuvers":[{"eventId":"evt_2","type":"TURN_RIGHT","distanceMeters":530,"roadName":"North Ave"},{"eventId":"evt_3","type":"ARRIVE","distanceMeters":1250}],
  "spatialInstructions":[{"id":"spatial_evt_2","type":"TURN_ARROW","anchor":{"kind":"ROUTE_POINT","routeDistanceMeters":530},"content":"TURN RIGHT\n120 m","priority":2,"lifetimeMs":4000}],
  "audioInstructions":[{"id":"audio_evt_2","content":"Turn right in 120 m.","priority":2,"speakAtDistanceMeters":530}],
  "routeSemantics":{"roadName":"North Ave","turnDirection":"right"},
  "handoffHints":{"confidence":0.95,"displayPriority":2,"staleAfterMs":5000}}}
